{
  "$schema": "https://json-schema.org/draft/2020-12/schema",
  "$id": "https://open-content-engine.example/schemas/config/brand.schema.json",
  "title": "Brand Configuration",
  "description": "Brand-scope configuration (brands/<brand-id>/brand.json). The brand-keyed structured-config layer (DD-10 / RD-5). One file per brand. Replaces production live-config files by generalizing their shapes; only the template ships, with NO real brand values. Spec ref: release-spec.md §11.3.",
  "x-stability": "stable",
  "x-schema-version": "1.0.0",
  "type": "object",
  "additionalProperties": false,
  "required": ["id", "display_name", "account_class", "platforms"],
  "properties": {
    "schema_version": {
      "type": "string",
      "description": "Version of this config shape, for migration handling (§11.1).",
      "pattern": "^\\d+\\.\\d+\\.\\d+$"
    },
    "id": {
      "type": "string",
      "description": "Stable brand id. Matches the brands/<brand-id>/ directory name and the 'brand' key used across artifacts.",
      "minLength": 1,
      "examples": ["acme-cosmos"]
    },
    "display_name": {
      "type": "string",
      "description": "Human-readable brand name.",
      "minLength": 1,
      "examples": ["Acme Cosmos"]
    },
    "account_class": {
      "description": "operator (a founder/operator-owned account, looser media strictness) vs brand (a brand/project account).",
      "type": "string",
      "enum": ["operator", "brand"]
    },
    "platforms": {
      "description": "Per-platform publishing configuration for this brand.",
      "type": "array",
      "minItems": 1,
      "items": { "$ref": "#/$defs/platform_binding" }
    },
    "cooldown_overrides": {
      "description": "Per-brand override of the system cooldown defaults (§8.6). Absent means inherit system.json cooldown.",
      "type": "object",
      "additionalProperties": false,
      "properties": {
        "hard_days": { "type": "integer", "minimum": 0 },
        "target_days": { "type": "integer", "minimum": 0 }
      }
    },
    "drama_dial": {
      "description": "Per-brand dramatization stance consumed by the voice/style rules. The brand-DNA authoring template carries the matching preference question.",
      "type": "string",
      "enum": ["low", "medium", "high"],
      "default": "medium"
    },
    "work_recap": {
      "description": "OPTIONAL per-brand work-recap / build-in-public settings (release-spec §3.3). Meaningful only for account_class=operator brands (founder/operator/team accounts share the build in the open with flexible voice). CONFIG-GATED and OFF BY DEFAULT — enable the pathway in system.json work_recap; this block scopes a brand's own memory source and private-term deny list when system.json work_recap.accounts references it (or single-account mode points at this brand). PRIVACY IS LOAD-BEARING: the repo ships the MECHANISM pointed at a configured path; it NEVER bundles real memory.",
      "type": "object",
      "additionalProperties": false,
      "properties": {
        "enabled": {
          "type": "boolean",
          "description": "Per-brand opt-in (still subject to the system.json work_recap.enabled master gate; both must be true). Defaults false.",
          "default": false
        },
        "memory_path": {
          "type": "string",
          "description": "Path to this account's SENSITIVE memory the source scans (read-only; never copied into the repo)."
        },
        "files": {
          "type": "array",
          "description": "Files-glob relative to memory_path. Supports an exact file and a single 'dir/*.ext' wildcard. Default ['MEMORY.md', 'memory/*.md'].",
          "items": { "type": "string", "minLength": 1 }
        },
        "lookback_days": {
          "type": "integer",
          "description": "How many days back the scan considers recent work. Default 3.",
          "minimum": 1
        },
        "private_terms": {
          "description": "Per-brand private-term deny list (partner names, codenames, unreleased feature names) — PUBLIC anti-targets to NOT print, unioned with the system-level list. Never secret VALUES. Either a flat string array or a { terms, secret_literals } object.",
          "oneOf": [
            { "type": "array", "items": { "type": "string", "minLength": 1 } },
            {
              "type": "object",
              "additionalProperties": false,
              "properties": {
                "case_insensitive": { "type": "boolean", "default": true },
                "terms": { "type": "array", "items": { "type": "string", "minLength": 1 } },
                "secret_literals": { "type": "array", "items": { "type": "string", "minLength": 1 } }
              }
            }
          ]
        }
      }
    },
    "ingestion": {
      "description": "OPTIONAL per-brand DATA-INGESTION & BRAND-IDENTITY settings (release-spec §1.1/§1.2; DD-10 brand-keyed). Consumed by the one-command brand-DNA flow in the C2 setup checkpoint when system.json brand_dna.enabled is true (both gates must hold). OFF BY DEFAULT — absent means the brand uses the manual authoring path only (DD-21). Names WHICH accounts to ingest the own-corpus from and WHICH competitors to analyze for patterns; competitor content is Zone U (RD-8) and analyzed for PATTERNS only, never republished verbatim. Handles are public anti-targets/identifiers, never secrets. Scraping is BYO (RD-9): a per-brand scraper.adapter ref may override the system default; manual submission + EXPORTS to manual_corpus_path are first-class and need no adapter.",
      "type": "object",
      "additionalProperties": false,
      "properties": {
        "account_handles": {
          "description": "Per-platform OWN-account handle(s) the own-corpus is ingested from (release-spec §1.1 Account Linking). Synthetic placeholders in shipped templates (e.g. @acmecosmos). Public identifiers, never secrets.",
          "type": "array",
          "items": { "$ref": "#/$defs/ingestion_handle" }
        },
        "competitors": {
          "description": "Competitor/comparator handles to ingest as Zone-U corpus and analyze for PATTERNS (release-spec §1.2 Competitor Identification). Each is untrusted third-party (RD-8) — analyzed for archetypes/hooks only, NEVER republished verbatim. Public handles, never secrets.",
          "type": "array",
          "items": { "$ref": "#/$defs/ingestion_competitor" }
        },
        "manual_corpus_path": {
          "$ref": "#/$defs/relative_path",
          "description": "CONTENT_HOME-relative directory the operator drops MANUAL / EXPORTED corpus items into (the first-class non-scraped path, RD-9). Items conform to schemas/inputs/corpus-item.schema.json. Defaults to the brand's corpora dir when absent."
        },
        "scraper": {
          "type": "object",
          "description": "OPTIONAL per-brand override of the system brand_dna.scraper adapter ref (DD-10). Absent inherits the system default; still BYO (RD-9, no creds bundled) and still a metered action gated by the cost estimate (DD-18).",
          "additionalProperties": false,
          "required": ["adapter"],
          "properties": {
            "adapter": {
              "type": "string",
              "description": "Registered scraper-adapter name for this brand (overrides system default). The manual/export path needs no adapter.",
              "minLength": 1,
              "examples": ["reference", "fixture"]
            },
            "provider": {
              "type": "object",
              "description": "Adapter-specific provider config (§12.5-style, opaque to the engine). Credential resolves BY NAME via secrets.js; no credential VALUE here.",
              "additionalProperties": true
            }
          }
        },
        "retention_class": {
          "description": "Default retention_class stamped on this brand's ingested corpus items at write (corpus-item.schema.json). Governs engine purge-corpora windows (system.json retention). Defaults to 'standard'; competitor corpus is typically 'transient' so it ages out fast.",
          "type": "string",
          "enum": ["transient", "standard", "retained"],
          "default": "standard"
        }
      }
    },
    "paths": {
      "description": "CONTENT_HOME-relative locations of this brand's authored assets. Absolute paths are forbidden.",
      "type": "object",
      "additionalProperties": false,
      "properties": {
        "dna": {
          "$ref": "#/$defs/relative_path",
          "description": "Brand DNA document."
        },
        "archetypes": {
          "$ref": "#/$defs/relative_path",
          "description": "Archetype catalog directory."
        },
        "corpora": {
          "$ref": "#/$defs/relative_path",
          "description": "Ingested corpora directory for this brand."
        }
      }
    }
  },
  "$defs": {
    "platform_binding": {
      "type": "object",
      "additionalProperties": false,
      "required": ["platform", "publisher"],
      "properties": {
        "platform": {
          "type": "string",
          "description": "Platform descriptor id (see platform-descriptor.schema.json).",
          "minLength": 1,
          "examples": ["twitter", "giphy", "instagram", "facebook", "youtube", "tiktok"]
        },
        "publisher": {
          "description": "Which publisher adapter carries this platform for this brand.",
          "type": "string",
          "enum": ["postiz", "giphy", "manual"]
        },
        "integration_ref": {
          "description": "The integration id the publisher shows in its settings for the connected account, recorded at account-connection time. For Postiz-backed lanes this is the Postiz integration id. Giphy lanes leave it null and use the Giphy credentials/username instead. Null until the account is connected (deferrable until LIVE).",
          "type": ["string", "null"],
          "default": null
        },
        "handle_placeholder": {
          "type": ["string", "null"],
          "description": "Display handle for this account. Synthetic placeholder in shipped templates (e.g. @acmecosmos).",
          "default": null
        },
        "rate_limit_per_day": {
          "type": "integer",
          "description": "Maximum posts per day for this brand×platform. Enforced by the publish gate.",
          "minimum": 0
        },
        "publish_windows": {
          "description": "Allowed local-time publish windows. Outside these windows the publish gate fails unless the queue entry is marked publish-immediately. Empty/absent means no window restriction.",
          "type": "array",
          "items": { "$ref": "#/$defs/publish_window" }
        },
        "auto_publish": {
          "$ref": "#/$defs/auto_publish_state",
          "description": "RD-10 auto-publish trust-state block — engine-maintained per brand×platform."
        }
      }
    },
    "publish_window": {
      "type": "object",
      "additionalProperties": false,
      "required": ["days", "start", "end"],
      "properties": {
        "days": {
          "type": "array",
          "description": "Days the window applies to.",
          "minItems": 1,
          "uniqueItems": true,
          "items": {
            "type": "string",
            "enum": ["mon", "tue", "wed", "thu", "fri", "sat", "sun"]
          }
        },
        "start": {
          "$ref": "#/$defs/clock_time",
          "description": "Window start, local HH:MM 24h."
        },
        "end": {
          "$ref": "#/$defs/clock_time",
          "description": "Window end, local HH:MM 24h. May be earlier than start to express a window that crosses midnight."
        }
      }
    },
    "auto_publish_state": {
      "type": "object",
      "additionalProperties": false,
      "description": "Auto-publish removes the publisher second gate for this lane (never the human approval). Entry/revocation are enforced mechanically by the engine (§15.5); operators set 'enabled', the engine maintains the rest.",
      "required": ["enabled"],
      "properties": {
        "enabled": {
          "type": "boolean",
          "description": "Operator opt-in. The engine still requires the trust criteria to be met before publishing automatically.",
          "default": false
        },
        "qualifying_streak": {
          "type": "integer",
          "description": "Consecutive qualifying publishes on this lane (engine-maintained). Reset to 0 on revocation.",
          "minimum": 0,
          "default": 0
        },
        "last_revocation": {
          "type": ["string", "null"],
          "description": "Timestamp of the most recent automatic revocation, or null.",
          "format": "date-time",
          "default": null
        },
        "revocation_reason": {
          "type": ["string", "null"],
          "description": "Reason for the most recent revocation, or null.",
          "default": null
        }
      }
    },
    "clock_time": {
      "type": "string",
      "description": "Local clock time, 24-hour HH:MM.",
      "pattern": "^([01]\\d|2[0-3]):[0-5]\\d$"
    },
    "relative_path": {
      "type": "string",
      "description": "CONTENT_HOME-relative path. Absolute paths and drive letters are forbidden.",
      "minLength": 1,
      "pattern": "^(?![A-Za-z]:)(?!/)(?!.*\\.\\.).+$"
    },
    "ingestion_handle": {
      "type": "object",
      "additionalProperties": false,
      "required": ["platform", "handle"],
      "properties": {
        "platform": {
          "type": "string",
          "description": "Platform the handle belongs to (twitter, instagram, youtube, tiktok, facebook, ...).",
          "minLength": 1,
          "examples": ["twitter", "instagram", "youtube", "tiktok", "facebook"]
        },
        "handle": {
          "type": "string",
          "description": "The public account handle (synthetic placeholder in shipped templates, e.g. @acmecosmos). Never a secret.",
          "minLength": 1,
          "examples": ["@acmecosmos"]
        }
      }
    },
    "ingestion_competitor": {
      "type": "object",
      "additionalProperties": false,
      "required": ["name", "handles"],
      "properties": {
        "name": {
          "type": "string",
          "description": "Human-readable competitor/comparator name (Zone U, RD-8). Synthetic in shipped templates. Public identifier; analyzed for patterns only, never republished.",
          "minLength": 1,
          "examples": ["Stellar Optics Co"]
        },
        "handles": {
          "description": "The competitor's public per-platform handle(s) to ingest as Zone-U corpus.",
          "type": "array",
          "minItems": 1,
          "items": { "$ref": "#/$defs/ingestion_handle" }
        }
      }
    }
  }
}
